{
  "schema": 1,
  "type": "EAM_PROJECT_CONTINUITY",
  "snapshotVersion": "2026-10-16.03",
  "updatedAt": "2026-10-16",
  "project": {
    "name": "EventAlertModRemake",
    "product": "wow_retail",
    "releaseTrack": "alpha",
    "supportedClients": [
      "PTR_12_1",
      "XPTR_12_0_7",
      "RETAIL_12_1"
    ]
  },
  "routes": {
    "humanSummary": "Docs/28_PROJECT_CONTINUITY.md",
    "issueLog": "Docs/15_DEVELOPMENT_ISSUE_LOG.md",
    "liveMatrix": "Data/LiveValidationMatrix.json",
    "testPlan": "Docs/06_TEST_PLAN_RETAIL.md",
    "flowFramework": "Docs/26_FLOW_VALIDATION_FRAMEWORK.md",
    "liveGuide": "Docs/29_LIVE_TEST_STEP_GUIDE.md"
  },
  "current": {
    "objective": "開發完成主動執行故障預測與威脅推論原則全面納入專案核心治理規範 (SOP Established)；全套 502 契約、108 Flow 測試、79 語法檢查 100% 綠燈通過。",
    "offlineValidation": {
      "source": "offline-mock",
      "total": 108,
      "passed": 108,
      "failed": 0,
      "skipped": 0,
      "pending": 0
    },
    "liveValidation": {
      "matrixVersion": "2026-08-14.1",
      "required": 37,
      "ptr": "pending",
      "xptr": "pending",
      "retail": "pending"
    }
  },
  "facts": [
    {
      "id": "FACT-20260801-001",
      "statement": "所有正式服開發修改只作用於實體專案根目錄；各客戶端 AddOns 連結不得被部署工具替換。",
      "state": "confirmed",
      "provenance": "project-rule",
      "environment": "cross-client",
      "evidenceRefs": [
        "Docs/27_LOCAL_WOW_ENVIRONMENT.md"
      ]
    },
    {
      "id": "FACT-20260801-002",
      "statement": "使用者在 PTR 12.1 觀察到兩套高度同步的 Aura 倒數。",
      "state": "confirmed",
      "provenance": "user-observed",
      "environment": "PTR_12_1",
      "evidenceRefs": [
        "issue:EAM-20260801-PTR121-AURA-DUAL-COUNTDOWN"
      ]
    },
    {
      "id": "FACT-20260801-003",
      "statement": "Native Aura 的內建倒數與 EAM DurationText 共用同一個 DurationObject。",
      "state": "confirmed",
      "provenance": "code-contract",
      "environment": "PTR_12_1",
      "evidenceRefs": [
        "issue:EAM-20260801-PTR121-AURA-DUAL-COUNTDOWN",
        "Docs/23_AURA_CONTAINER_IMPLEMENTATION.md"
      ]
    },
    {
      "id": "FACT-20260801-004",
      "statement": "本輪完整離線 Flow 驗證為 54/54，無 failed、skipped 或 pending。",
      "state": "confirmed",
      "provenance": "offline-test",
      "environment": "offline-mock",
      "evidenceRefs": [
        "Tests/FlowValidationHarness.lua",
        "Debug/FlowTestRunner.lua"
      ]
    },
    {
      "id": "FACT-20260801-005",
      "statement": "真人實機矩陣已擴充為 37 案，但三個客戶端目前均未完成簽收。",
      "state": "confirmed",
      "provenance": "project-state",
      "environment": "cross-client",
      "evidenceRefs": [
        "Data/LiveValidationMatrix.json",
        "Docs/06_TEST_PLAN_RETAIL.md"
      ]
    },
    {
      "id": "FACT-20260801-006",
      "statement": "磁碟上的遊戲報告只有在玩家完成保存時機後才可視為最新。",
      "state": "confirmed",
      "provenance": "user-observed",
      "environment": "cross-client",
      "evidenceRefs": [
        "Docs/26_FLOW_VALIDATION_FRAMEWORK.md"
      ]
    },
    {
      "id": "FACT-20260801-007",
      "statement": "12.1 AddDispelTypeTexture 適用官方驅散或靜態 Aura 邊框，不是任意條件 Glow。",
      "state": "confirmed",
      "provenance": "api-contract",
      "environment": "PTR_12_1",
      "evidenceRefs": [
        "issue:EAM-20260801-PTR121-TARGET-AURA-LIFECYCLE",
        "Docs/25_RETAIL_API_CHANGE_INTELLIGENCE.md"
      ]
    },
    {
      "id": "FACT-20260801-008",
      "statement": "UnitPower 次要資源可使用安全數字，可能為 Secret 的主要資源百分比只可直送原生顯示元件。",
      "state": "confirmed",
      "provenance": "api-contract",
      "environment": "cross-client",
      "evidenceRefs": [
        "issue:EAM-20260801-UNITPOWER-CAPABILITY",
        "Debug/UnitPowerCapabilityProbe.lua"
      ]
    },
    {
      "id": "FACT-20260801-009",
      "statement": "本輪靜態與離線 gate 為 Lua 47 檔語法通過、Flow 54/54、Validation Contracts 217/217。",
      "state": "confirmed",
      "provenance": "offline-test",
      "environment": "offline-mock",
      "evidenceRefs": [
        "Tools/CheckLuaSyntax.ps1",
        "Tools/Test-ValidationContracts.ps1",
        "issue:EAM-20260801-CONTINUITY-CONTRACT"
      ]
    },
    {
      "id": "FACT-20260808-001",
      "statement": "PTR8 Pandemic Region、Dispel options 與停用 AuraContainer 清除契約已接入初始化流程與 strict mock；尚無 PTR 實機簽收。",
      "state": "confirmed",
      "provenance": "offline-test",
      "environment": "PTR_12_1",
      "evidenceRefs": [
        "Debug/FlowTestRunner.lua",
        "Tests/Mocks/WoW121AuraMock.lua",
        "Data/LiveValidationMatrix.json"
      ]
    },
    {
      "id": "FACT-20260808-002",
      "statement": "PTR 12.1.0.69189 官方生成文件未證實 StatusBar:SetUnit、SetPowerTextFontString、SetOnUpdateMode；可確認的 UnitPower 路徑是 UnitPowerPercent 單向送入 StatusBar:SetValue 或 Texture:SetRadialProgressBarPercent。",
      "state": "confirmed",
      "provenance": "api-contract",
      "environment": "PTR_12_1",
      "evidenceRefs": [
        "Debug/UnitPowerCapabilityProbe.lua",
        "Docs/25_RETAIL_API_CHANGE_INTELLIGENCE.md"
      ]
    },
    {
      "id": "FACT-20260808-003",
      "statement": "2026-08-08 唯讀環境斷言確認 Retail 12.0.7.68974、PTR 12.1.0.69189、XPTR 12.0.7.68887，三個 AddOns SymbolicLink 均指向實體專案。",
      "state": "confirmed",
      "provenance": "offline-test",
      "environment": "cross-client",
      "evidenceRefs": [
        "TestResults/EAM_LocalWoWEnvironment_20260808_194717447.json",
        "Docs/27_LOCAL_WOW_ENVIRONMENT.md"
      ]
    },
    {
      "id": "FACT-20260809-001",
      "statement": "玩家在 PTR 12.1.0.69189 確認 Alpha 1 可顯示 Aura，Alpha 2 完全不顯示。",
      "state": "confirmed",
      "provenance": "user-observed",
      "environment": "PTR_12_1",
      "evidenceRefs": [
        "issue:EAM-20260809-ALPHA2-NATIVE-GATE"
      ]
    },
    {
      "id": "FACT-20260809-002",
      "statement": "Alpha 2 曾以 public-test AND test-build 判定 Native runtime；PTR 69189 的 raw flags 為 public-test=true、test-build=false、beta=false，因此 gate 必然關閉。",
      "state": "confirmed",
      "provenance": "code-contract",
      "environment": "PTR_12_1",
      "evidenceRefs": [
        "Services/AuraCapabilityService.lua",
        "Tests/Mocks/WoW121AuraMock.lua",
        "issue:EAM-20260809-ALPHA2-NATIVE-GATE"
      ]
    },
    {
      "id": "FACT-20260809-003",
      "statement": "PTR 69189 UnitPower 報告顯示 primary Secret 與 selected safe-number 均被 StatusBar 和 radial sink 接受，但人工視覺分別為 pending 與 blocked，且未收集 raw values。",
      "state": "confirmed",
      "provenance": "live-report",
      "environment": "PTR_12_1",
      "evidenceRefs": [
        "issue:EAM-20260809-PTR69189-UNITPOWER-PARTIAL"
      ]
    },
    {
      "id": "FACT-20260809-004",
      "statement": "Alpha 3 候選已離線完成 Target Aura hover+Ctrl+Alt、Macro spell/item ID、手動複製、About、監控 Tooltip 與七色分類邊框。",
      "state": "confirmed",
      "provenance": "offline-test",
      "environment": "cross-client",
      "evidenceRefs": [
        "Debug/FlowTestRunner.lua",
        "Docs/29_LIVE_TEST_STEP_GUIDE.md",
        "issue:EAM-20260809-ALPHA3-SVG-BORDER"
      ]
    },
    {
      "id": "FACT-20260809-005",
      "statement": "PTR 12.1.0.69189 固定生成文件與 Warcraft Wiki VectorGraphics 知識頁確認：VectorGraphics 提供 SetSVG/ClearSVG/HasSVG/GetSVGFileID；Texture 固定契約只提供 SetSVG/ClearSVG。",
      "state": "confirmed",
      "provenance": "api-contract",
      "environment": "PTR_12_1",
      "evidenceRefs": [
        "Debug/SVGCapabilityProbe.lua",
        "Schemas/EAM_SVGCapabilityReport.schema.json",
        "Docs/25_RETAIL_API_CHANGE_INTELLIGENCE.md"
      ]
    },
    {
      "id": "FACT-20260809-006",
      "statement": "3px 邊框幾何與非對稱 SVG lifecycle 已納入 strict mock、Flow 與 Validation Contracts；Texture introspection 呼叫固定為零，離線通過不得升格為 PTR 實機通過。",
      "state": "confirmed",
      "provenance": "offline-test",
      "environment": "offline-mock",
      "evidenceRefs": [
        "UI/AlertBorderStyles.lua",
        "Tests/Mocks/WoW121AuraMock.lua",
        "Tools/Test-ValidationContracts.ps1",
        "Tests/Fixtures/EAM_SVGCapabilityReport.ptr69189-observed.json"
      ]
    },
    {
      "id": "FACT-20260809-007",
      "statement": "PTR 69189 Alpha 3 SVG 報告確認 VectorGraphics 與 Texture 的 SetSVG 均 accepted 且圖樣目視 pass；Vector fileIDClass=zero 可正常渲染，Texture Has/Get unavailable 符合固定 API，但舊探針未執行 Texture clear/reload，整份仍不能升格為完整 pass。",
      "state": "confirmed",
      "provenance": "live-report",
      "environment": "PTR_12_1",
      "evidenceRefs": [
        "Tests/Fixtures/EAM_SVGCapabilityReport.ptr69189-observed.json",
        "issue:EAM-20260809-PTR69189-SVG-ASYMMETRY"
      ]
    },
    {
      "id": "FACT-20260812-001",
      "statement": "語系 catalog 現已包含 enUS、zhTW、zhCN、koKR、ruRU；ruRU 與 enUS 的 L.* key 完整對齊，Auto Detect 為固定英文且預設選項；穩定 EAM.L identity 與 UI binding／refresh registry 可在不重新載入時即時切換。",
      "state": "confirmed",
      "provenance": "code-contract",
      "environment": "project",
      "evidenceRefs": [
        "Locale/Common.lua",
        "Core/Main.lua",
        "Debug/FlowTestRunner.lua",
        "TestResults/EAM_FlowValidation_all_20260812_234217.json",
        "Tools/Test-ValidationContracts.ps1",
        "issue:EAM-20260812-LOCALE-SELECTOR"
      ]
    },
    {
      "id": "FACT-20260812-002",
      "statement": "小地圖按鈕固定使用內建 Trade_Engineering 齒輪 fallback；EAM 自有視窗已提供 EAM、FF7、Windows XP、Windows 7、Windows 10、Windows 3.1、Borland、DOS CRT、倚天中文、Red Alert、macOS Aqua 十一種可保存主題，戰鬥中切換延後套用。",
      "state": "confirmed",
      "provenance": "code-contract",
      "environment": "project",
      "evidenceRefs": [
        "Media/SVG/eam-minimap.svg",
        "UI/Options.lua",
        "UI/Theme.lua",
        "Docs/03_STATE_SCHEMA.md",
        "issue:EAM-20260812-MINIMAP-SVG-THEME"
      ]
    },
    {
      "id": "FACT-20260812-003",
      "statement": "PTR 12.1 build 69273 的 UnitPower capability report 中，primary 是 Secret、selected 是 safe-number，StatusBar 與 radial sink 均 accepted；兩案 visualObservation 都是 pending，報告 status=incomplete。",
      "state": "confirmed",
      "provenance": "user-observed",